{
  "schemaVersion": 1,
  "catalogVersion": "2026.08.1",
  "updatedAt": "2026-08-09T17:02:18.858Z",
  "agents": [
    {
      "packageId": "com.alfaservice.support-rag-v1",
      "agentId": "support-rag-template",
      "version": "1.0.0",
      "title": "Supporto RAG documentazione",
      "description": "Template supporto tecnico — ticket Jira → RAG documentazione → risposta con fonti.",
      "kind": "SupportProfile",
      "tags": [
        "support",
        "rag",
        "jira"
      ],
      "license": "MIT",
      "minCoreVersion": "0.1.0",
      "downloadUrl": "https://getfluxa.it/agents/com.alfaservice.support-rag-v1/1.0.0/pack.fluxa-agent",
      "sha256": "d002a999171c8cb35e0617a0e9585541cc4ac91167f966fa60d32fd3f9698f1f",
      "signature": "aNPyLQUod5XMWUuTj5ESs1o8KzOKyijqqtGu3HgubDZTLbRXP2oh6KEpbK8jmwQCe+E9XhEHK5awPToHnk3DDg==",
      "sourceUrl": "https://github.com/fluxa-ai/fluxa-agents/tree/main/agents/com.alfaservice.support-rag-v1"
    },
    {
      "packageId": "com.alfaservice.pm-breakdown-v1",
      "agentId": "pm-breakdown-template",
      "version": "1.0.0",
      "title": "PM — analisi e breakdown Jira",
      "description": "Template project manager — label ANALISI → analisi codebase → breakdown Story/Sottotask Jira.",
      "kind": "ProjectManagerProfile",
      "tags": [
        "pm",
        "jira",
        "breakdown"
      ],
      "license": "MIT",
      "minCoreVersion": "0.1.0",
      "downloadUrl": "https://getfluxa.it/agents/com.alfaservice.pm-breakdown-v1/1.0.0/pack.fluxa-agent",
      "sha256": "5e3899ce1753199b93b41aa79aef41a351497a4bac9c42e7483fa34dedaf6a80",
      "signature": "IY3qgdQp8iHKudt6E1qA8ySZjWTSvmXRUXIEiJXpoHqXP3xcS7Gfck3aFscB96Q9+lUtZ50YIzp3LTzWRdcWCA==",
      "sourceUrl": "https://github.com/fluxa-ai/fluxa-agents/tree/main/agents/com.alfaservice.pm-breakdown-v1"
    },
    {
      "packageId": "com.alfaservice.developer-jira-v1",
      "agentId": "developer-jira-template",
      "version": "1.0.0",
      "title": "Developer — coding da Jira via Cursor",
      "description": "Template developer AI — ticket Jira assignee → Cursor locale su repo mappati.",
      "kind": "DeveloperProfile",
      "tags": [
        "developer",
        "jira",
        "cursor"
      ],
      "license": "MIT",
      "minCoreVersion": "0.1.0",
      "downloadUrl": "https://getfluxa.it/agents/com.alfaservice.developer-jira-v1/1.0.0/pack.fluxa-agent",
      "sha256": "99838bc394a918513ee32bd222d715b1704c33e41eb60bb854d96899e2582f32",
      "signature": "a9Meu3LchW9x7iQcs5UwnvhQkNTHY5RTUIkhG+ZM2qEmApcCgmu2sE3nN2DRyYo0WekbasmpXh/xVVxYCZYdBw==",
      "sourceUrl": "https://github.com/fluxa-ai/fluxa-agents/tree/main/agents/com.alfaservice.developer-jira-v1"
    }
  ]
}